{
  "$schema": "https://json-schema.org/draft/2020-12/schema",
  "$id": "https://contextwindowarchitecture.io/schema/dashboard/session.v1.schema.json",
  "title": "CWA dashboard session",
  "description": "One conversation's turns in order, one row per event, with the tokens each plane took, the turn's compressions and budget omissions, and how many of its payload's parts it reused from the turn before, for the session page. Derived from the session's events; the contract has no sessions, the wrapper assigns them.",
  "type": "object",
  "additionalProperties": false,
  "required": ["$schema", "session_id", "route", "service", "profile", "turns", "part_reuse"],
  "properties": {
    "$schema": {
      "const": "cwa-dashboard/session/v1"
    },
    "session_id": {
      "$ref": "#/$defs/nonblank"
    },
    "route": {
      "$ref": "https://contextwindowarchitecture.io/schema/route_policy.schema.json#/properties/route"
    },
    "service": {
      "$ref": "#/$defs/nonblank"
    },
    "profile": {
      "type": "object",
      "additionalProperties": false,
      "required": ["id", "version"],
      "properties": {
        "id": {
          "$ref": "https://contextwindowarchitecture.io/schema/profile.schema.json#/properties/id"
        },
        "version": {
          "$ref": "https://contextwindowarchitecture.io/schema/profile.schema.json#/properties/version"
        }
      }
    },
    "turns": {
      "type": "array",
      "minItems": 1,
      "items": {
        "$ref": "#/$defs/turn"
      }
    },
    "part_reuse": {
      "description": "Over the turns compared with the assembled turn before them, both with payload parts: how many leading parts they reused, of how many parts they had. All zero when no turn could be compared, which the page reads as not available.",
      "type": "object",
      "additionalProperties": false,
      "required": ["compared_turns", "reused_parts", "parts"],
      "properties": {
        "compared_turns": {
          "type": "integer",
          "minimum": 0
        },
        "reused_parts": {
          "type": "integer",
          "minimum": 0
        },
        "parts": {
          "type": "integer",
          "minimum": 0
        }
      }
    }
  },
  "$defs": {
    "nonblank": {
      "type": "string",
      "minLength": 1,
      "pattern": "[^\\t\\n\\v\\f\\r \\u00a0\\u1680\\u2000-\\u200a\\u2028\\u2029\\u202f\\u205f\\u3000\\ufeff]"
    },
    "turn": {
      "type": "object",
      "additionalProperties": false,
      "required": ["turn_index", "event_id", "outcome"],
      "properties": {
        "turn_index": {
          "type": "integer",
          "minimum": 0
        },
        "event_id": {
          "type": "string",
          "pattern": "^[0-9A-HJKMNP-TV-Z]{26}$"
        },
        "outcome": {
          "enum": ["assembled", "refused", "rejected"]
        },
        "input_tokens": {
          "description": "trace.result.input_tokens.",
          "type": "integer",
          "minimum": 0
        },
        "budget_input": {
          "description": "snapshot.budget.input: the budget the turn was assembled, or refused, against.",
          "type": "integer",
          "minimum": 0
        },
        "by_plane": {
          "description": "The included tokens of each plane, by the short plane names of contract/slot-defaults.json; all zero for a refusal, whose trace includes nothing.",
          "type": "object",
          "additionalProperties": false,
          "required": ["gov", "state", "evid", "inter"],
          "properties": {
            "gov": {
              "type": "integer",
              "minimum": 0
            },
            "state": {
              "type": "integer",
              "minimum": 0
            },
            "evid": {
              "type": "integer",
              "minimum": 0
            },
            "inter": {
              "type": "integer",
              "minimum": 0
            }
          }
        },
        "compressed_count": {
          "description": "The trace's compressed rows.",
          "type": "integer",
          "minimum": 0
        },
        "over_budget_count": {
          "description": "The trace's excluded rows with reason over_budget.",
          "type": "integer",
          "minimum": 0
        },
        "refused_reason": {
          "$ref": "#/$defs/nonblank"
        },
        "parts": {
          "description": "How many parts the turn's payload format delimits (payload.parts).",
          "type": "integer",
          "minimum": 0
        },
        "reused_parts": {
          "description": "How many of those parts, from the first, equal the previous assembled turn's in section, id and digest. Absent for the first assembled turn, or when either turn's payload has no parts.",
          "type": "integer",
          "minimum": 0
        }
      },
      "allOf": [
        {
          "if": {
            "properties": {
              "outcome": {
                "enum": ["assembled", "refused"]
              }
            }
          },
          "then": {
            "required": ["budget_input", "by_plane", "compressed_count", "over_budget_count"]
          }
        },
        {
          "if": {
            "properties": {
              "outcome": {
                "const": "assembled"
              }
            }
          },
          "then": {
            "required": ["input_tokens"],
            "not": {
              "required": ["refused_reason"]
            }
          }
        },
        {
          "if": {
            "properties": {
              "outcome": {
                "const": "refused"
              }
            }
          },
          "then": {
            "required": ["refused_reason"],
            "not": {
              "anyOf": [
                {
                  "required": ["input_tokens"]
                },
                {
                  "required": ["parts"]
                }
              ]
            }
          }
        },
        {
          "if": {
            "properties": {
              "outcome": {
                "const": "rejected"
              }
            }
          },
          "then": {
            "not": {
              "anyOf": [
                {
                  "required": ["input_tokens"]
                },
                {
                  "required": ["by_plane"]
                },
                {
                  "required": ["budget_input"]
                },
                {
                  "required": ["refused_reason"]
                },
                {
                  "required": ["parts"]
                }
              ]
            }
          }
        }
      ],
      "dependentRequired": {
        "reused_parts": ["parts"]
      }
    }
  }
}
