{
  "$schema": "cwa-dashboard/session/v1",
  "session_id": "fixture-c1",
  "route": "contract-fixture",
  "service": "contract-fixture",
  "profile": {
    "id": "fixture-three-slot",
    "version": 1
  },
  "turns": [
    {
      "turn_index": 0,
      "event_id": "01M4Z96GFMM96EVAPDB61FA3YM",
      "outcome": "assembled",
      "input_tokens": 34,
      "by_plane": {
        "gov": 9,
        "state": 0,
        "evid": 10,
        "inter": 6
      },
      "compressed_count": 0,
      "over_budget_count": 0
    },
    {
      "turn_index": 1,
      "event_id": "01M4Z98B2MXAHPP1FQV5R1P39M",
      "outcome": "rejected"
    }
  ],
  "part_reuse": {
    "compared_turns": 0,
    "reused_parts": 0,
    "parts": 0
  }
}
