{
  "$schema": "cwa-dashboard/session/v1",
  "session_id": "intake-12",
  "route": "document-qa",
  "service": "intake-assistant",
  "profile": {
    "id": "document-analysis",
    "version": 1
  },
  "turns": [
    {
      "turn_index": 0,
      "event_id": "01M4ZG4ZM48MAN296TJPP3NVXM",
      "outcome": "assembled",
      "input_tokens": 160,
      "by_plane": {
        "gov": 63,
        "state": 0,
        "evid": 39,
        "inter": 40
      },
      "compressed_count": 0,
      "over_budget_count": 0,
      "parts": 2
    },
    {
      "turn_index": 1,
      "event_id": "01M4ZGKMC4FAH0M12TN8R3QYPE",
      "outcome": "assembled",
      "input_tokens": 215,
      "by_plane": {
        "gov": 63,
        "state": 0,
        "evid": 39,
        "inter": 87
      },
      "compressed_count": 0,
      "over_budget_count": 0,
      "parts": 2,
      "reused_parts": 1
    },
    {
      "turn_index": 2,
      "event_id": "01M4ZHGXW4QVNQ7FTKA8D9EVT2",
      "outcome": "refused",
      "by_plane": {
        "gov": 0,
        "state": 0,
        "evid": 0,
        "inter": 0
      },
      "compressed_count": 0,
      "over_budget_count": 0,
      "refused_reason": "evidence_required"
    }
  ],
  "part_reuse": {
    "compared_turns": 1,
    "reused_parts": 1,
    "parts": 2
  }
}
